{
  "$schema": "https://json-schema.org/draft/2020-12/schema",
  "$id": "https://example.com/schemas/battery_soc_devices.schema.json",
  "title": "Battery SoC Devices Configuration",
  "description": "JSON configuration for battery_soc_mqtt.py.",
  "type": "array",
  "minItems": 1,
  "items": {
    "title": "Battery State-of-Charge Device",
    "description": "Configuration for one battery state-of-charge calculation.",
    "type": "object",
    "required": ["id", "name"],
    "additionalProperties": false,
    "properties": {
      "id": { "type": "string", "minLength": 1, "default": "new_battery_soc", "title": "Identifier", "description": "Unique identifier used in MQTT topics and Home Assistant device IDs." },
      "name": { "type": "string", "minLength": 1, "default": "New Battery SoC", "title": "Display name", "description": "Human-readable name for the battery state-of-charge device." },
      "via_device": { "type": "string", "minLength": 1, "default": "energy-node", "title": "Parent device", "description": "Home Assistant device identifier that provides the battery telemetry." },
      "charger_power_topic": { "type": "string", "format": "mqtt-topic", "default": "", "title": "Charger power topic", "description": "MQTT topic that reports charger power." },
      "charger_power_json_key": { "type": "string", "format": "mqtt-json-key", "default": "", "title": "Charger power JSON key", "description": "JSON property containing charger power in the charger message. Leave empty when the topic carries a bare number, as the Trucki sticks publish it; a Shelly reports an object and needs its key here, for example apower." },
      "inverter_power_topic": { "type": "string", "format": "mqtt-topic", "default": "", "title": "Inverter power topic", "description": "MQTT topic that reports inverter power." },
      "inverter_power_json_key": { "type": "string", "format": "mqtt-json-key", "default": "", "title": "Inverter power JSON key", "description": "JSON property containing inverter power in the inverter message. Leave empty when the topic carries a bare number, as the Trucki sticks publish it; a Shelly reports an object and needs its key here, for example apower." },
      "charger_dc_power_topic": { "type": "string", "format": "mqtt-topic", "default": "", "title": "Charger DC power topic", "description": "Optional MQTT topic that reports charger power measured on the DC bus, for example DCPOWER from a Trucki T2MG. When set and fresh it replaces the AC charger measurement and no converter efficiency is applied." },
      "charger_dc_power_json_key": { "type": "string", "format": "mqtt-json-key", "default": "", "title": "Charger DC power JSON key", "description": "JSON property containing DC charger power. Leave empty when the topic carries a bare number." },
      "inverter_dc_power_topic": { "type": "string", "format": "mqtt-topic", "default": "", "title": "Inverter DC power topic", "description": "Optional MQTT topic that reports inverter power drawn from the DC bus. When set and fresh it replaces the AC inverter measurement and no converter efficiency is applied." },
      "inverter_dc_power_json_key": { "type": "string", "format": "mqtt-json-key", "default": "", "title": "Inverter DC power JSON key", "description": "JSON property containing DC inverter power. Leave empty when the topic carries a bare number." },
      "dc_max_age_s": { "type": "number", "minimum": 0, "default": 60, "title": "DC measurement maximum age", "description": "Seconds a DC power reading stays valid. Once it is older the corresponding AC measurement takes over again." },
      "bank_a_voltage_topic": { "type": "string", "format": "mqtt-topic", "default": "", "title": "Bank A voltage topic", "description": "MQTT topic that reports battery bank A voltage." },
      "bank_a_voltage_json_key": { "type": "string", "format": "mqtt-json-key", "default": "", "title": "Bank A voltage JSON key", "description": "JSON property containing battery bank A voltage." },
      "bank_a_voltage_scale": { "type": "number", "exclusiveMinimum": 0, "default": 1.0, "title": "Bank A voltage scale", "description": "Multiplier applied to the reported bank A voltage." },
      "bank_b_voltage_topic": { "type": "string", "format": "mqtt-topic", "default": "", "title": "Bank B voltage topic", "description": "MQTT topic that reports battery bank B voltage." },
      "bank_b_voltage_json_key": { "type": "string", "format": "mqtt-json-key", "default": "", "title": "Bank B voltage JSON key", "description": "JSON property containing battery bank B voltage." },
      "bank_b_voltage_scale": { "type": "number", "exclusiveMinimum": 0, "default": 1.0, "title": "Bank B voltage scale", "description": "Multiplier applied to the reported bank B voltage." },
      "bank_a_cell_count": { "type": "integer", "exclusiveMinimum": 0, "default": 8, "title": "Bank A cell count", "description": "Number of cells connected in series in battery bank A." },
      "bank_a_capacity_ah": { "type": "number", "exclusiveMinimum": 0, "default": 100, "title": "Bank A capacity", "description": "Nominal capacity of battery bank A in ampere-hours." },
      "bank_b_cell_count": { "type": "integer", "exclusiveMinimum": 0, "default": 8, "title": "Bank B cell count", "description": "Number of cells connected in series in battery bank B." },
      "bank_b_capacity_ah": { "type": "number", "exclusiveMinimum": 0, "default": 100, "title": "Bank B capacity", "description": "Nominal capacity of battery bank B in ampere-hours." },
      "topology": { "type": "string", "enum": ["parallel", "series"], "default": "parallel", "title": "Bank topology", "description": "How the two banks are wired. 'parallel' means both banks sit on the same DC bus and form one battery with a single bus voltage; a second voltage measurement is rejected because Kirchhoff forces both terminal voltages equal. 'series' means the banks are stacked, carry the same current and each needs its own voltage measurement." },
      "charger_ac_dc_efficiency": { "type": "number", "minimum": 0.5, "maximum": 1, "default": 0.9, "title": "Charger AC/DC efficiency", "description": "Fraction of the charger's measured mains power that arrives on the DC bus. MeanWell chargers are typically 0.88 to 0.92." },
      "inverter_dc_ac_efficiency": { "type": "number", "minimum": 0.5, "maximum": 1, "default": 0.9, "title": "Inverter DC/AC efficiency", "description": "Fraction of the DC bus power drawn by the inverter that reappears as measured mains power. Lumentree inverters are typically 0.90 to 0.93." },
      "charge_efficiency": { "type": "number", "exclusiveMinimum": 0, "maximum": 1, "default": 0.98, "title": "Charge efficiency", "description": "Fraction of charging energy retained by the battery." },
      "battery_chemistry": { "type": "string", "enum": ["lifepo4"], "default": "lifepo4", "title": "Battery chemistry", "description": "Cell chemistry. Only LiFePO4 is supported today; the calibration thresholds and the simulation curve both assume its flat mid-range voltage curve." },
      "soc_curve": { "type": "string", "enum": ["generic_lifepo4", "dyness_ar2.5"], "default": "generic_lifepo4", "title": "State-of-charge curve", "description": "Shape of the open-circuit voltage curve. 'generic_lifepo4' is a textbook LiFePO4 shape without a manufacturer source - the right pick when no data sheet for the installed cells exists. 'dyness_ar2.5' reproduces table 2-1 of the Dyness AR2.5-24V manual exactly, but only together with the empty/full thresholds 2.70 and 3.50 V per cell. The curve only sets the shape; where it sits in absolute volts is decided by those two thresholds." },
      "empty_v_per_cell": { "type": "number", "exclusiveMinimum": 0, "default": 2.7, "title": "Empty voltage per cell", "description": "Open-circuit voltage per cell used as the empty-battery calibration point. Must be reachable in practice: if the inverter cuts off above this voltage the 0% calibration never fires and the coulomb counter drifts without an anchor. 2.70 V equals 21.6 V on an 8-cell pack, the 0% row of the Dyness AR2.5 table." },
      "full_v_per_cell": { "type": "number", "exclusiveMinimum": 0, "default": 3.5, "title": "Full voltage per cell", "description": "Open-circuit voltage per cell used as the full-battery calibration point. 3.50 V equals 28.0 V on an 8-cell pack, the 100% row of the Dyness AR2.5 table. If the charger's constant-voltage setpoint stays below this, the calibration tolerance below is what still lets the 100% calibration fire." },
      "calibration_tolerance_v_per_cell": { "type": "number", "minimum": 0, "default": 0.08, "title": "Calibration tolerance at low current", "description": "How far the empty/full calibration thresholds may soften when little current flows, in volts per cell. At rest or during the charger's constant-voltage taper the measured voltage is practically the open-circuit voltage, so a reading that falls just short may still calibrate; at bulk current the load compensation is too uncertain and the full threshold is demanded. Scales linearly between 0.02C and 0.10C. Set to 0 for hard thresholds." },
      "internal_resistance_mohm_per_cell": { "type": "number", "minimum": 0, "maximum": 50, "title": "Internal resistance per cell", "description": "Optional override for the load compensation, in milliohms per cell. Leave empty to use the built-in load-offset table (equivalent to roughly 1.2 milliohms). Measure it as (loaded voltage - rest voltage) / current / cell count." },
      "bank_b_enabled": { "type": "boolean", "default": true, "title": "Bank B present", "description": "Set to false for installations with only one battery bank. Bank B is then excluded from the current split, the combined state of charge and the imbalance warning." },
      "imbalance_warn_v": { "type": "number", "minimum": 0, "default": 0.5, "title": "Bank imbalance warning threshold", "description": "Absolute voltage difference between bank A and bank B in volts above which the imbalance warning turns on. 0.5 V is roughly 60 mV per cell on an 8-cell bank." },
      "calibration_hold_s": { "type": "number", "minimum": 0, "default": 120, "title": "Calibration hold time", "description": "Seconds a voltage must remain stable before calibration is applied." },
      "voltage_soc_mismatch_warn_pct": { "type": "number", "minimum": 0, "default": 25, "title": "Voltage/coulomb mismatch threshold", "description": "Percentage points of deviation between the voltage-based SoC estimate and the coulomb-counted SoC above which the mismatch warning can turn on. Kept generous because the voltage estimate is very uncertain in the flat LiFePO4 mid-range." },
      "voltage_mismatch_hold_s": { "type": "number", "minimum": 0, "default": 300, "title": "Voltage/coulomb mismatch hold time", "description": "Seconds the deviation must stay above the threshold before the mismatch warning turns on." },
      "state_file": { "type": "string", "minLength": 1, "default": "/home/energynode/battery_soc/state.json", "title": "State file", "description": "Path used to persist the calculated battery state." },
      "stale_input_s": { "type": "number", "minimum": 0, "default": 120, "title": "Stale input timeout", "description": "Seconds after which an input without updates is considered stale." },
      "require_fresh_inputs": { "type": "boolean", "default": false, "title": "Require fresh inputs", "description": "False (default): a stale input does not halt the calculation - stale power topics count as 0 W and stale voltage readings keep their last known value (the 0%/100% calibration always still requires a fresh voltage, regardless of this setting). True restores the strict legacy behaviour where coulomb counting pauses completely while any configured input is stale." },
      "simulation_charger_power_w": { "type": "number", "default": 200, "title": "Simulation charger power", "description": "Charger power in watts used by simulation mode." },
      "simulation_inverter_power_w": { "type": "number", "default": 50, "title": "Simulation inverter power", "description": "Inverter power in watts used by simulation mode." }
    }
  }
}
